{
  "schema_version": "offer-optimization/v2",
  "policy_version": "offer-optimization-policy/v2",
  "context_digest": "sha256:aaaaaaaaaaaaaaaaaaaaaaaaaaaaaaaaaaaaaaaaaaaaaaaaaaaaaaaaaaaaaaaa",
  "raw_context_retained": false,
  "outcome": "OFFER_SELECTED",
  "selected_product_ref": "variant:301",
  "selected_offer_ref": "offer:501",
  "evaluations": [
    {
      "offer_ref": "offer:501",
      "product_ref": "variant:301",
      "status": "SELECTED",
      "selection_rank": 1,
      "total_cost": "354.99",
      "cashback_amount": "10.00",
      "landed_cost": "344.99",
      "currency": "EUR",
      "return_period_days": 30,
      "merchant_reliability": "0.92",
      "freshness": "0.98",
      "reason_codes": ["verified_landed_cost_returns_and_operational_evidence"],
      "evidence_refs": ["cashback:501", "merchant-quality:41", "offer-truth:501", "returns:501"]
    }
  ],
  "result_digest": "sha256:bbbbbbbbbbbbbbbbbbbbbbbbbbbbbbbbbbbbbbbbbbbbbbbbbbbbbbbbbbbbbbbb"
}
